{
  "$schema": "https://json-schema.org/draft/2020-12/schema",
  "$id": "urn:zrotext:proposed-managed-reader-policy-vectors:1",
  "title": "Synthetic proposed managed reader signed evidence vectors",
  "type": "object",
  "additionalProperties": false,
  "required": [
    "profile",
    "synthetic",
    "result_kind",
    "trusted_now_ms",
    "origin",
    "account_hex",
    "root_pin_hex",
    "expected_root_fingerprint_hex",
    "accepted_previous_version",
    "accepted_previous_digest_hex",
    "accepted_manifest_hex",
    "archive_key_id_hex",
    "policy_hex",
    "policy_digest_hex",
    "enrollment_hex",
    "enrollment_signature_hex",
    "enrollment_digest_hex",
    "attestation_hex",
    "attestation_signature_hex",
    "attestation_digest_hex",
    "negative_mutations"
  ],
  "properties": {
    "profile": {
      "const": "managed-reader-signed-evidence-01"
    },
    "synthetic": {
      "const": true
    },
    "result_kind": {
      "const": "cryptographic_signed_evidence"
    },
    "trusted_now_ms": {
      "type": "string",
      "minLength": 1,
      "maxLength": 19,
      "pattern": "^[1-9][0-9]{0,18}$",
      "not": {
        "pattern": "[^0-9]"
      }
    },
    "origin": {
      "type": "string",
      "minLength": 9,
      "maxLength": 512,
      "pattern": "^https://[!-~]+$",
      "not": {
        "pattern": "[^!-~]"
      }
    },
    "account_hex": {
      "type": "string",
      "minLength": 32,
      "maxLength": 32,
      "pattern": "^([0-9a-f]{2})+$",
      "allOf": [
        {
          "not": {
            "pattern": "[^0-9a-f]"
          }
        },
        {
          "not": {
            "const": "00000000000000000000000000000000"
          }
        }
      ]
    },
    "root_pin_hex": {
      "type": "string",
      "minLength": 188,
      "maxLength": 188,
      "pattern": "^([0-9a-f]{2})+$",
      "allOf": [
        {
          "not": {
            "pattern": "[^0-9a-f]"
          }
        },
        {
          "not": {
            "const": "00000000000000000000000000000000000000000000000000000000000000000000000000000000000000000000000000000000000000000000000000000000000000000000000000000000000000000000000000000000000000000000"
          }
        }
      ]
    },
    "expected_root_fingerprint_hex": {
      "type": "string",
      "minLength": 64,
      "maxLength": 64,
      "pattern": "^([0-9a-f]{2})+$",
      "allOf": [
        {
          "not": {
            "pattern": "[^0-9a-f]"
          }
        },
        {
          "not": {
            "const": "0000000000000000000000000000000000000000000000000000000000000000"
          }
        }
      ]
    },
    "accepted_previous_version": {
      "type": "string",
      "minLength": 1,
      "maxLength": 19,
      "pattern": "^[1-9][0-9]{0,18}$",
      "not": {
        "pattern": "[^0-9]"
      }
    },
    "accepted_previous_digest_hex": {
      "type": "string",
      "minLength": 64,
      "maxLength": 64,
      "pattern": "^([0-9a-f]{2})+$",
      "allOf": [
        {
          "not": {
            "pattern": "[^0-9a-f]"
          }
        },
        {
          "not": {
            "const": "0000000000000000000000000000000000000000000000000000000000000000"
          }
        }
      ]
    },
    "accepted_manifest_hex": {
      "type": "string",
      "minLength": 728,
      "maxLength": 19502,
      "pattern": "^([0-9a-f]{2})+$",
      "allOf": [
        {
          "not": {
            "pattern": "[^0-9a-f]"
          }
        },
        {
          "not": {
            "const": "00000000000000000000000000000000000000000000000000000000000000000000000000000000000000000000000000000000000000000000000000000000000000000000000000000000000000000000000000000000000000000000000000000000000000000000000000000000000000000000000000000000000000000000000000000000000000000000000000000000000000000000000000000000000000000000000000000000000000000000000000000000000000000000000000000000000000000000000000000000000000000000000000000000000000000000000000000000000000000000000000000000000000000000000000000000000000000000000000000000000000000000000000000000000000000000000000000000000000000000000000000000000000000000000000000000000000000000000000000000000000000000000000000000000000000000000000000000000000000000000000000000"
          }
        }
      ]
    },
    "archive_key_id_hex": {
      "type": "string",
      "minLength": 64,
      "maxLength": 64,
      "pattern": "^([0-9a-f]{2})+$",
      "allOf": [
        {
          "not": {
            "pattern": "[^0-9a-f]"
          }
        },
        {
          "not": {
            "const": "0000000000000000000000000000000000000000000000000000000000000000"
          }
        }
      ]
    },
    "policy_hex": {
      "type": "string",
      "minLength": 572,
      "maxLength": 3048,
      "pattern": "^([0-9a-f]{2})+$",
      "allOf": [
        {
          "not": {
            "pattern": "[^0-9a-f]"
          }
        },
        {
          "not": {
            "const": "00000000000000000000000000000000000000000000000000000000000000000000000000000000000000000000000000000000000000000000000000000000000000000000000000000000000000000000000000000000000000000000000000000000000000000000000000000000000000000000000000000000000000000000000000000000000000000000000000000000000000000000000000000000000000000000000000000000000000000000000000000000000000000000000000000000000000000000000000000000000000000000000000000000000000000000000000000000000000000000000000000000000000000000000000000000000000000000000000000000000000000000000000000000000000000000"
          }
        }
      ]
    },
    "policy_digest_hex": {
      "type": "string",
      "minLength": 64,
      "maxLength": 64,
      "pattern": "^([0-9a-f]{2})+$",
      "allOf": [
        {
          "not": {
            "pattern": "[^0-9a-f]"
          }
        },
        {
          "not": {
            "const": "0000000000000000000000000000000000000000000000000000000000000000"
          }
        }
      ]
    },
    "enrollment_hex": {
      "type": "string",
      "minLength": 1210,
      "maxLength": 2216,
      "pattern": "^([0-9a-f]{2})+$",
      "allOf": [
        {
          "not": {
            "pattern": "[^0-9a-f]"
          }
        },
        {
          "not": {
            "const": "0000000000000000000000000000000000000000000000000000000000000000000000000000000000000000000000000000000000000000000000000000000000000000000000000000000000000000000000000000000000000000000000000000000000000000000000000000000000000000000000000000000000000000000000000000000000000000000000000000000000000000000000000000000000000000000000000000000000000000000000000000000000000000000000000000000000000000000000000000000000000000000000000000000000000000000000000000000000000000000000000000000000000000000000000000000000000000000000000000000000000000000000000000000000000000000000000000000000000000000000000000000000000000000000000000000000000000000000000000000000000000000000000000000000000000000000000000000000000000000000000000000000000000000000000000000000000000000000000000000000000000000000000000000000000000000000000000000000000000000000000000000000000000000000000000000000000000000000000000000000000000000000000000000000000000000000000000000000000000000000000000000000000000000000000000000000000000000000000000000000000000000000000000000000000000000000000000000000000000000000000000000000000000000000000000000000000000000000000000000000000000000000000000000000000000000000000000000000000000000000000000000000"
          }
        }
      ]
    },
    "enrollment_signature_hex": {
      "type": "string",
      "minLength": 128,
      "maxLength": 128,
      "pattern": "^([0-9a-f]{2})+$",
      "allOf": [
        {
          "not": {
            "pattern": "[^0-9a-f]"
          }
        },
        {
          "not": {
            "const": "00000000000000000000000000000000000000000000000000000000000000000000000000000000000000000000000000000000000000000000000000000000"
          }
        }
      ]
    },
    "enrollment_digest_hex": {
      "type": "string",
      "minLength": 64,
      "maxLength": 64,
      "pattern": "^([0-9a-f]{2})+$",
      "allOf": [
        {
          "not": {
            "pattern": "[^0-9a-f]"
          }
        },
        {
          "not": {
            "const": "0000000000000000000000000000000000000000000000000000000000000000"
          }
        }
      ]
    },
    "attestation_hex": {
      "type": "string",
      "minLength": 884,
      "maxLength": 884,
      "pattern": "^([0-9a-f]{2})+$",
      "allOf": [
        {
          "not": {
            "pattern": "[^0-9a-f]"
          }
        },
        {
          "not": {
            "const": "00000000000000000000000000000000000000000000000000000000000000000000000000000000000000000000000000000000000000000000000000000000000000000000000000000000000000000000000000000000000000000000000000000000000000000000000000000000000000000000000000000000000000000000000000000000000000000000000000000000000000000000000000000000000000000000000000000000000000000000000000000000000000000000000000000000000000000000000000000000000000000000000000000000000000000000000000000000000000000000000000000000000000000000000000000000000000000000000000000000000000000000000000000000000000000000000000000000000000000000000000000000000000000000000000000000000000000000000000000000000000000000000000000000000000000000000000000000000000000000000000000000000000000000000000000000000000000000000000000000000000000000000000000000000000000000000000000000000000000000000000000000000000000000000000000000000000000000"
          }
        }
      ]
    },
    "attestation_signature_hex": {
      "type": "string",
      "minLength": 128,
      "maxLength": 128,
      "pattern": "^([0-9a-f]{2})+$",
      "allOf": [
        {
          "not": {
            "pattern": "[^0-9a-f]"
          }
        },
        {
          "not": {
            "const": "00000000000000000000000000000000000000000000000000000000000000000000000000000000000000000000000000000000000000000000000000000000"
          }
        }
      ]
    },
    "attestation_digest_hex": {
      "type": "string",
      "minLength": 64,
      "maxLength": 64,
      "pattern": "^([0-9a-f]{2})+$",
      "allOf": [
        {
          "not": {
            "pattern": "[^0-9a-f]"
          }
        },
        {
          "not": {
            "const": "0000000000000000000000000000000000000000000000000000000000000000"
          }
        }
      ]
    },
    "negative_mutations": {
      "type": "array",
      "minItems": 1,
      "maxItems": 128,
      "items": {
        "type": "object",
        "additionalProperties": false,
        "required": [
          "name",
          "target",
          "offset",
          "xor"
        ],
        "properties": {
          "name": {
            "type": "string",
            "minLength": 1,
            "maxLength": 64,
            "pattern": "^[a-z][a-z0-9-]*$",
            "not": {
              "pattern": "[^a-z0-9-]"
            }
          },
          "target": {
            "enum": [
              "policy",
              "enrollment",
              "attestation"
            ]
          },
          "offset": {
            "type": "integer",
            "minimum": 0,
            "maximum": 1523
          },
          "xor": {
            "type": "integer",
            "minimum": 1,
            "maximum": 255
          }
        }
      }
    }
  }
}
