{
  "profile": "managed-reader-signed-evidence-01",
  "synthetic": true,
  "result_kind": "cryptographic_signed_evidence",
  "trusted_now_ms": "2000",
  "origin": "https://owner.invalid",
  "account_hex": "01010101010101010101010101010101",
  "root_pin_hex": "5a54525002010101010101010101010101010101010000000000000001046b17d1f2e12c4247f8bce6e563a440f277037d812deb33a0f4a13945d898c2964fe342e2fe1a7f9b8ee7eb4a7c0f9e162bce33576b315ececbb6406837bf51f5",
  "expected_root_fingerprint_hex": "650363c155189c0015b94a30cd545f34c4894e88f12d486f4e47694634068540",
  "accepted_previous_version": "6",
  "accepted_previous_digest_hex": "0909090909090909090909090909090909090909090909090909090909090909",
  "accepted_manifest_hex": "5a544d4102010101010101010101010101010101010000000000000001000000000000000700000000000003e8000000000036f6500909090909090909090909090909090909090909090909090909090909090909046b17d1f2e12c4247f8bce6e563a440f277037d812deb33a0f4a13945d898c2964fe342e2fe1a7f9b8ee7eb4a7c0f9e162bce33576b315ececbb6406837bf51f504018b1bd41b441815d172b5fcaa6b88178f1856c553c28c1dee2aac20e4b75c51dd047cf27b188d034f7e8a52380304b51ac3c08969e277f21b35a60b48fc4766997807775510db8ed040293d9ac69f7430dbba7dade63ce982299e04b79d227873d10404040404040404040404040404040405050505050505050505050505050505000400000000000003e8000000000036f6500102a7f5fac9ffbf8b4528c8cc22c33b6aaa953bcc41110ccbf6ca96b57e6a6241d1045ecbe4d1a6330a44c8f7ef951d4bf165e6c6b721efada985fb41661bc6e7fd6c8734640c4998ff7e374b06ce1a64a2ecd82ab036384fb83d9a79b127a27d50320000000000000000000000000000000000000000000000000000000000000000000c00000000000003e8000000000036f65001049820627b90765b6838372f3ca368aedd591abc11b36b0116111eb210189866d404e2534a3532d08fbba02dde659ee62bd0031fe2db785596ef509302446b030852e0f1575a4c633cc719dfee5fda862d764efc96c3f30ee0055c42c23f184ed8c60404040404040404040404040404040405050505050505050505050505050505000200000000000003e8000000000036f6500106b0d8345f27248e9485b6ab3aeb3d458b6786ee54fa3650613829964e79446587046b17d1f2e12c4247f8bce6e563a440f277037d812deb33a0f4a13945d898c2964fe342e2fe1a7f9b8ee7eb4a7c0f9e162bce33576b315ececbb6406837bf51f50000000000000000000000000000000000000000000000000000000000000000000000000000000003e8000000000036f65001ada5c025961f79b24a510a707956c90938e05e5100b5b859a0d64032a56332907a5c040b7f5b3b9b1b0293af8c9cc4813cf19b912f1a689e57b9552675899ce9",
  "archive_key_id_hex": "a7f5fac9ffbf8b4528c8cc22c33b6aaa953bcc41110ccbf6ca96b57e6a6241d1",
  "policy_hex": "5a4d5043010101010101010101010101010101010101001568747470733a2f2f6f776e65722e696e76616c69641515151515151515151515151515151595da12e63c480f22564cfd7929494e843e773efbc771fc9e3317dd54676e438d043ed113b7883b4c590638379db0c21cda16742ed0255048bf433391d374bc21d19099209accc4c8a224c843afa4f4c68a090d04da5e9889dae2f8eefce82a3740161616161616161616161616161616160000000000000001030008001000010001000000000000ea60171717171717171717171717171717171717171717171717171717171717171700000000000003e80000000000000fa0000118181818181818181818181818181818191919191919191919191919191919191919191919191919191919191919191900",
  "policy_digest_hex": "3c86c67860adb934b504b45c77349de22369517fc8f249a88958706cef36afeb",
  "enrollment_hex": "5a4d524501011a1a1a1a1a1a1a1a1a1a1a1a1a1a1a1a010101010101010101010101010101011e1e1e1e1e1e1e1e1e1e1e1e1e1e1e1e1f1f1f1f1f1f1f1f1f1f1f1f1f1f1f1f20202020202020202020202020202020001568747470733a2f2f6f776e65722e696e76616c696400000000000007d000000000000008340000000000000001650363c155189c0015b94a30cd545f34c4894e88f12d486f4e4769463406854000000000000000078ddb1fefed2291fc2c1655f08622deaa59ca89eee9ce4d6030eccb4c877afc7b000000000000000821212121212121212121212121212121212121212121212121212121212121211b1b1b1b1b1b1b1b1b1b1b1b1b1b1b1b000000000000000106ff86cd75a6ec1c25bdde41999a7198bd03ac5020bf5cdd3ac7eba109f325c604cef66d6b2a3a993e591214d1ea223fb545ca6c471c48306e4c36069404c5723f878662a229aaae906e123cdd9d3b4c10590ded29fe751eeeca34bbaa44af07731c1c1c1c1c1c1c1c1c1c1c1c1c1c1c1c04741dd5bda817d95e4626537320e5d55179983028b2f82c99d500c5ee8624e3c40770b46a9c385fdc567383554887b1548eeb912c35ba5ca71995ff22cd4481d3cc212b7c3eb9996515fe7b363f245e608d8bbf1a0b0b5490f4bba31dde9b6358151515151515151515151515151515151616161616161616161616161616161600000000000000013c86c67860adb934b504b45c77349de22369517fc8f249a88958706cef36afeb181818181818181818181818181818180cd2ae76e3a799346bcea7e518785ebdb96868ab237a2087ab011cad2fe171c7000800000000000007d00000000000000bb8",
  "enrollment_signature_hex": "2727158a804a47d13899a8bf4b81a987a3b4f2416001dab217119290d0ac4be336ecd5a73f123051bb7c5f7c7ee929ff8afe37d58a3719a90ee01de01a9cb227",
  "enrollment_digest_hex": "c6e1fa7b451a3564c8e6b248f0cffcb618a33d46df4e1b3f0a8474c73a46c49d",
  "attestation_hex": "5a4d435001011a1a1a1a1a1a1a1a1a1a1a1a1a1a1a1a010101010101010101010101010101010000000000000001650363c155189c0015b94a30cd545f34c4894e88f12d486f4e4769463406854000000000000000078ddb1fefed2291fc2c1655f08622deaa59ca89eee9ce4d6030eccb4c877afc7b1b1b1b1b1b1b1b1b1b1b1b1b1b1b1b1b000000000000000106ff86cd75a6ec1c25bdde41999a7198bd03ac5020bf5cdd3ac7eba109f325c604cef66d6b2a3a993e591214d1ea223fb545ca6c471c48306e4c36069404c5723f878662a229aaae906e123cdd9d3b4c10590ded29fe751eeeca34bbaa44af07731c1c1c1c1c1c1c1c1c1c1c1c1c1c1c1ccc212b7c3eb9996515fe7b363f245e608d8bbf1a0b0b5490f4bba31dde9b6358151515151515151515151515151515151616161616161616161616161616161600000000000000013c86c67860adb934b504b45c77349de22369517fc8f249a88958706cef36afeb181818181818181818181818181818181d1d1d1d1d1d1d1d1d1d1d1d1d1d1d1d1d1d1d1d1d1d1d1d1d1d1d1d1d1d1d1d0000000000000007d00000000000000dac000800000000000007d00000000000000bb8",
  "attestation_signature_hex": "795e6db9c48fef8f74ab52cb169bda5c9a7868903339e520a34f9cc73505eb722529826960c9d2141a81639f27f6f4c91d41074751e76d0a9c403fe171c96a37",
  "attestation_digest_hex": "0cd2ae76e3a799346bcea7e518785ebdb96868ab237a2087ab011cad2fe171c7",
  "negative_mutations": [
    {
      "name": "policy-tag",
      "target": "policy",
      "offset": 0,
      "xor": 1
    },
    {
      "name": "policy-account",
      "target": "policy",
      "offset": 6,
      "xor": 1
    },
    {
      "name": "policy-origin",
      "target": "policy",
      "offset": 24,
      "xor": 1
    },
    {
      "name": "policy-issuer",
      "target": "policy",
      "offset": 45,
      "xor": 1
    },
    {
      "name": "policy-runtime-assurance",
      "target": "policy",
      "offset": 297,
      "xor": 1
    },
    {
      "name": "enrollment-tag",
      "target": "enrollment",
      "offset": 0,
      "xor": 1
    },
    {
      "name": "enrollment-account",
      "target": "enrollment",
      "offset": 22,
      "xor": 1
    },
    {
      "name": "enrollment-owner-user",
      "target": "enrollment",
      "offset": 38,
      "xor": 1
    },
    {
      "name": "enrollment-owner-session",
      "target": "enrollment",
      "offset": 54,
      "xor": 1
    },
    {
      "name": "enrollment-approval",
      "target": "enrollment",
      "offset": 70,
      "xor": 1
    },
    {
      "name": "enrollment-origin",
      "target": "enrollment",
      "offset": 88,
      "xor": 1
    },
    {
      "name": "enrollment-issued",
      "target": "enrollment",
      "offset": 116,
      "xor": 1
    },
    {
      "name": "enrollment-root-generation",
      "target": "enrollment",
      "offset": 132,
      "xor": 1
    },
    {
      "name": "enrollment-root-fingerprint",
      "target": "enrollment",
      "offset": 133,
      "xor": 1
    },
    {
      "name": "enrollment-predecessor-version",
      "target": "enrollment",
      "offset": 172,
      "xor": 1
    },
    {
      "name": "enrollment-successor-version",
      "target": "enrollment",
      "offset": 212,
      "xor": 1
    },
    {
      "name": "enrollment-scope",
      "target": "enrollment",
      "offset": 599,
      "xor": 1
    },
    {
      "name": "attestation-tag",
      "target": "attestation",
      "offset": 0,
      "xor": 1
    },
    {
      "name": "attestation-account",
      "target": "attestation",
      "offset": 22,
      "xor": 1
    },
    {
      "name": "attestation-root-generation",
      "target": "attestation",
      "offset": 45,
      "xor": 1
    },
    {
      "name": "attestation-root-fingerprint",
      "target": "attestation",
      "offset": 46,
      "xor": 1
    },
    {
      "name": "attestation-reader",
      "target": "attestation",
      "offset": 118,
      "xor": 1
    },
    {
      "name": "attestation-runtime",
      "target": "attestation",
      "offset": 359,
      "xor": 1
    },
    {
      "name": "attestation-assurance",
      "target": "attestation",
      "offset": 407,
      "xor": 1
    },
    {
      "name": "attestation-scope",
      "target": "attestation",
      "offset": 424,
      "xor": 1
    }
  ]
}
